<?xml version="1.0" encoding="UTF-8"?>
<openmensa version="2.0"
           xmlns="http://openmensa.org/open-mensa-v2"
           xmlns:xsi="http://www.w3.org/2001/XMLSchema-instance"
           xsi:schemaLocation="http://openmensa.org/open-mensa-v2 http://openmensa.org/open-mensa-v2.xsd">
  <canteen>
    <day date='2015-02-02'>
      <category name='Essen 1'>
        <meal>
          <name>Aloo Gobi</name>
          <note>und einer Beilage nach Wahl (5)</note>
          <price role='student'>1.60</price>
          <price role='employee'>3.2</price>
          <price role='other'>3.2</price>
        </meal>
      </category>
      <category name='Essen 2'>
        <meal>
          <name>Ebly-Gemüsepfanne</name>
          <note>und einer Beilage nach Wahl (A, L)</note>
          <price role='student'>3.00</price>
          <price role='employee'>4.6</price>
          <price role='other'>4.6</price>
        </meal>
      </category>
      <category name='Essen 3'>
        <meal>
          <name>Erbseneintopf mit Würstchen</name>
          <note>mit Bauernbrot (2, 3, 5, I)</note>
          <price role='student'>2.00</price>
          <price role='employee'>3.6</price>
          <price role='other'>3.6</price>
        </meal>
      </category>
      <category name='Essen 4'>
        <meal>
          <name>Frankfurter Apfelweinbraten</name>
          <note>und zwei Beilagen nach Wahl (L)</note>
          <price role='student'>3.80</price>
          <price role='employee'>5.4</price>
          <price role='other'>5.4</price>
        </meal>
      </category>
      <category name='Essen 5'>
        <meal>
          <name>Kartoffel-Lauchsuppe</name>
          <note>(5, I)</note>
          <price role='student'>0.90</price>
          <price role='employee'>2.5</price>
          <price role='other'>2.5</price>
        </meal>
      </category>
      <category name='Essen 6'>
        <meal>
          <name>Rindfleischfrikadelle</name>
          <note>Rahmwirsing und einer Beilage nach Wahl (A, C)</note>
          <price role='student'>2.30</price>
          <price role='employee'>3.9</price>
          <price role='other'>3.9</price>
        </meal>
      </category>
    </day>
    <day date='2015-02-03'>
      <category name='Essen 1'>
        <meal>
          <name>Gulasch Berliner Art</name>
          <note>Zöpflinudeln und einer Beilage nach Wahl</note>
          <price role='student'>3.20</price>
          <price role='employee'>4.8</price>
          <price role='other'>4.8</price>
        </meal>
      </category>
      <category name='Essen 2'>
        <meal>
          <name>Hirse-Käsetaler</name>
          <note>mit Sauce Vegetale und einer Beilage nach Wahl (A, C, F, G, I)</note>
          <price role='student'>2.00</price>
          <price role='employee'>3.6</price>
          <price role='other'>3.6</price>
        </meal>
      </category>
      <category name='Essen 3'>
        <meal>
          <name>Trierer Bohnensuppe</name>
          <note>(2, F, G, I)</note>
          <price role='student'>0.90</price>
          <price role='employee'>2.5</price>
          <price role='other'>2.5</price>
        </meal>
      </category>
      <category name='Essen 4'>
        <meal>
          <name>Ungarische Hähnchenkeule</name>
          <note>mit Geflügelsauce und zwei Beilagen nach Wahl (C, G)</note>
          <price role='student'>3.20</price>
          <price role='employee'>4.8</price>
          <price role='other'>4.8</price>
        </meal>
      </category>
    </day>
    <day date='2015-02-04'>
      <category name='Essen 1'>
        <meal>
          <name>Hokifilet mit Blattspinat</name>
          <note>und zwei Beilagen nach Wahl (A, D, G, I)</note>
          <price role='student'>4.40</price>
          <price role='employee'>6</price>
          <price role='other'>6</price>
        </meal>
      </category>
      <category name='Essen 2'>
        <meal>
          <name>Kirschpfannkuchen</name>
          <note>mit Vanillesauce und einer Beilage nach Wahl (A, C, G)</note>
          <price role='student'>2.50</price>
          <price role='employee'>4.1</price>
          <price role='other'>4.1</price>
        </meal>
      </category>
      <category name='Essen 3'>
        <meal>
          <name>Paprikasuppe</name>
          <note>(I)</note>
          <price role='student'>0.90</price>
          <price role='employee'>2.5</price>
          <price role='other'>2.5</price>
        </meal>
      </category>
      <category name='Essen 4'>
        <meal>
          <name>Pizza Hawaii</name>
          <note>(2, 3, A, G)</note>
          <price role='student'>3.70</price>
          <price role='employee'>5.3</price>
          <price role='other'>5.3</price>
        </meal>
      </category>
      <category name='Essen 5'>
        <meal>
          <name>Pizza Margherita</name>
          <note>(A, G)</note>
          <price role='student'>3.70</price>
          <price role='employee'>5.3</price>
          <price role='other'>5.3</price>
        </meal>
      </category>
      <category name='Essen 6'>
        <meal>
          <name>Schweine Cordon Bleu</name>
          <note>mit Bratensauce und zwei Beilagen nach Wahl (A, C, G, I)</note>
          <price role='student'>4.50</price>
          <price role='employee'>6.1</price>
          <price role='other'>6.1</price>
        </meal>
      </category>
      <category name='Essen 7'>
        <meal>
          <name>Schweinekotelett gefüllt mit Feta</name>
          <note>Kräuterbutter und einer Beilage nach Wahl (3, G)</note>
          <price role='student'>4.00</price>
          <price role='employee'>5.6</price>
          <price role='other'>5.6</price>
        </meal>
      </category>
    </day>
    <day date='2015-02-05'>
      <category name='Essen 1'>
        <meal>
          <name>Gemüse-Tomatensuppe</name>
          <note>(F, I)</note>
          <price role='student'>0.90</price>
          <price role='employee'>2.5</price>
          <price role='other'>2.5</price>
        </meal>
      </category>
      <category name='Essen 2'>
        <meal>
          <name>Gemüseauflauf</name>
          <note>und einer Beilage nach Wahl (5, A, G, I, J)</note>
          <price role='student'>1.90</price>
          <price role='employee'>3.5</price>
          <price role='other'>3.5</price>
        </meal>
      </category>
      <category name='Essen 3'>
        <meal>
          <name>Pizza Salami</name>
          <note>(2, 3, A, I, J, G)</note>
          <price role='student'>3.70</price>
          <price role='employee'>5.3</price>
          <price role='other'>5.3</price>
        </meal>
      </category>
      <category name='Essen 4'>
        <meal>
          <name>Pizza Spinat</name>
          <note>(3, A, G)</note>
          <price role='student'>3.70</price>
          <price role='employee'>5.3</price>
          <price role='other'>5.3</price>
        </meal>
      </category>
      <category name='Essen 5'>
        <meal>
          <name>Tiroler Gröstl</name>
          <note>und einer Beilage nach Wahl (5, F, I)</note>
          <price role='student'>3.00</price>
          <price role='employee'>4.6</price>
          <price role='other'>4.6</price>
        </meal>
      </category>
      <category name='Essen 6'>
        <meal>
          <name>Wildschweinbratwurst</name>
          <note>mit Apfelrotkohl und einer Beilage nach Wahl (I)</note>
          <price role='student'>2.90</price>
          <price role='employee'>4.5</price>
          <price role='other'>4.5</price>
        </meal>
      </category>
    </day>
    <day date='2015-02-06'>
      <category name='Essen 1'>
        <meal>
          <name>Bunte Gemüsesuppe</name>
          <note>(I)</note>
          <price role='student'>0.90</price>
          <price role='employee'>2.5</price>
          <price role='other'>2.5</price>
        </meal>
      </category>
      <category name='Essen 2'>
        <meal>
          <name>Florentiner Hähnchenbrust</name>
          <note>mit Pfefferrahmsauce und zwei Beilagen nach Wahl (A, G)</note>
          <price role='student'>3.70</price>
          <price role='employee'>5.3</price>
          <price role='other'>5.3</price>
        </meal>
      </category>
      <category name='Essen 3'>
        <meal>
          <name>Kichererbsen-Kartoffelcurry</name>
          <note>und zwei Beilagen nach Wahl (5, I)</note>
          <price role='student'>1.90</price>
          <price role='employee'>3.5</price>
          <price role='other'>3.5</price>
        </meal>
      </category>
      <category name='Essen 4'>
        <meal>
          <name>Paniertes Schollenfilet</name>
          <note>mit Remouladensauce und einer Beilage nach Wahl (A, D)</note>
          <price role='student'>3.60</price>
          <price role='employee'>5.2</price>
          <price role='other'>5.2</price>
        </meal>
      </category>
    </day>
    <day date='2015-02-07'>
      <category name='Essen 1'>
        <meal>
          <name>Bunte Gemüsesuppe</name>
          <note>(I)</note>
          <price role='student'>0.90</price>
          <price role='employee'>2.5</price>
          <price role='other'>2.5</price>
        </meal>
      </category>
      <category name='Essen 2'>
        <meal>
          <name>China-Gemüseschnitte mit</name>
          <note>Curryrahmsauce und zwei Beilagen nach Wahl (A, G, I, J)</note>
          <price role='student'>2.60</price>
          <price role='employee'>4.2</price>
          <price role='other'>4.2</price>
        </meal>
      </category>
      <category name='Essen 3'>
        <meal>
          <name>Rindfleischbällchen</name>
          <note>mit Rahmsauce und einer Beilage nach Wahl</note>
          <price role='student'>3.30</price>
          <price role='employee'>4.9</price>
          <price role='other'>4.9</price>
        </meal>
      </category>
    </day>

  </canteen>
</openmensa>
