<?xml version="1.0" encoding="UTF-8"?>
<openmensa version="2.0"
           xmlns="http://openmensa.org/open-mensa-v2"
           xmlns:xsi="http://www.w3.org/2001/XMLSchema-instance"
           xsi:schemaLocation="http://openmensa.org/open-mensa-v2 http://openmensa.org/open-mensa-v2.xsd">
  <canteen>
    <day date='2015-02-16'>
      <category name='Essen 1'>
        <meal>
          <name>Kartoffel-Lauchsuppe</name>
          <price role='student'>0.90</price>
          <price role='employee'>2.5</price>
          <price role='other'>2.5</price>
        </meal>
      </category>
      <category name='Essen 2'>
        <meal>
          <name>Gemüsekroketten</name>
          <note>mit Tomatensauce</note>
          <price role='student'>2.40</price>
          <price role='employee'>4</price>
          <price role='other'>4</price>
        </meal>
      </category>
      <category name='Essen 3'>
        <meal>
          <name>Bratwurst</name>
          <note>mit Curry-Ketchupsauce</note>
          <price role='student'>3.00</price>
          <price role='employee'>4.6</price>
          <price role='other'>4.6</price>
        </meal>
      </category>
    </day>
    <day date='2015-02-17'>
      <category name='Essen 1'>
        <meal>
          <name>Tomatencremesuppe</name>
          <price role='student'>0.90</price>
          <price role='employee'>2.5</price>
          <price role='other'>2.5</price>
        </meal>
      </category>
      <category name='Essen 2'>
        <meal>
          <name>Reibekuchen</name>
          <note>mit Apfelmus und einer Beilage nach Wahl</note>
          <price role='student'>2.00</price>
          <price role='employee'>3.6</price>
          <price role='other'>3.6</price>
        </meal>
      </category>
      <category name='Essen 3'>
        <meal>
          <name>Kohlroulade</name>
          <note>mit Zwiebelsauce und zwei Beilagen nach Wahl</note>
          <price role='student'>2.50</price>
          <price role='employee'>4.1</price>
          <price role='other'>4.1</price>
        </meal>
      </category>
    </day>
    <day date='2015-02-18'>
      <category name='Essen 1'>
        <meal>
          <name>Paprikasuppe</name>
          <price role='student'>0.90</price>
          <price role='employee'>2.5</price>
          <price role='other'>2.5</price>
        </meal>
      </category>
      <category name='Essen 2'>
        <meal>
          <name>China-Gemüseschnitte</name>
          <note>mit Curry-Fruchtsauce</note>
          <price role='student'>2.80</price>
          <price role='employee'>4.4</price>
          <price role='other'>4.4</price>
        </meal>
      </category>
      <category name='Essen 3'>
        <meal>
          <name>Geflügelfrikadelle</name>
          <note>mit Pfefferrahmsauce</note>
          <price role='student'>2.70</price>
          <price role='employee'>4.3</price>
          <price role='other'>4.3</price>
        </meal>
      </category>
    </day>
    <day date='2015-02-19'>
      <category name='Essen 1'>
        <meal>
          <name>Gemüse-Tomatensuppe</name>
          <price role='student'>0.90</price>
          <price role='employee'>2.5</price>
          <price role='other'>2.5</price>
        </meal>
      </category>
      <category name='Essen 2'>
        <meal>
          <name>Vollkornnudeln mit Zucchini und Schafskäse</name>
          <note>und einer Beilage nach Wahl</note>
          <price role='student'>2.60</price>
          <price role='employee'>4.2</price>
          <price role='other'>4.2</price>
        </meal>
      </category>
      <category name='Essen 3'>
        <meal>
          <name>berbackene Hähnchenbrust mit Broccoli</name>
          <note>mit Geflügelsauce</note>
          <price role='student'>3.20</price>
          <price role='employee'>4.8</price>
          <price role='other'>4.8</price>
        </meal>
      </category>
    </day>
    <day date='2015-02-20'>
      <category name='Essen 1'>
        <meal>
          <name>Bunte Gemüsesuppe</name>
          <price role='student'>0.90</price>
          <price role='employee'>2.5</price>
          <price role='other'>2.5</price>
        </meal>
      </category>
      <category name='Essen 2'>
        <meal>
          <name>Paprika-Kartoffelauflauf</name>
          <price role='student'>2.00</price>
          <price role='employee'>3.6</price>
          <price role='other'>3.6</price>
        </meal>
      </category>
      <category name='Essen 3'>
        <meal>
          <name>Kartoffelgulasch mit Würstchen</name>
          <note>und einer Beilage nach Wahl</note>
          <price role='student'>3.00</price>
          <price role='employee'>4.6</price>
          <price role='other'>4.6</price>
        </meal>
      </category>
    </day>

  </canteen>
</openmensa>
