<?xml version="1.0" encoding="UTF-8"?>
<openmensa version="2.0"
           xmlns="http://openmensa.org/open-mensa-v2"
           xmlns:xsi="http://www.w3.org/2001/XMLSchema-instance"
           xsi:schemaLocation="http://openmensa.org/open-mensa-v2 http://openmensa.org/open-mensa-v2.xsd">
  <canteen>
    <day date='2015-11-23'>
      <category name='Essen 1'>
        <meal>
          <name>Kürbiscremesuppe</name>
          <price role='student'>0.90</price>
          <price role='employee'>2.5</price>
          <price role='other'>2.5</price>
        </meal>
      </category>
      <category name='Essen 2'>
        <meal>
          <name>Kartoffel-Blumenkohlpfanne</name>
          <note>mit Pfefferrahmsauce (3, F) und einer Beilage nach Wahl</note>
          <price role='student'>2.20</price>
          <price role='employee'>3.8</price>
          <price role='other'>3.8</price>
        </meal>
      </category>
      <category name='Essen 3'>
        <meal>
          <name>Linseneintopf</name>
          <note>mit Wiener Würstchen (2, 3, I) und einem Kaiserbrötchen (A)</note>
          <price role='student'>2.10</price>
          <price role='employee'>3.7</price>
          <price role='other'>3.7</price>
        </meal>
      </category>
      <category name='Essen 4'>
        <meal>
          <name>Ebly-Gemüsepfanne</name>
          <note>mit Pfefferrahmsauce (3, F)</note>
          <price role='student'>2.00</price>
          <price role='employee'>3.6</price>
          <price role='other'>3.6</price>
        </meal>
      </category>
      <category name='Essen 5'>
        <meal>
          <name>Geflügeleintopf Portugiesisch</name>
          <note>mit Kaiserbrötchen (A)</note>
          <price role='student'>2.10</price>
          <price role='employee'>3.7</price>
          <price role='other'>3.7</price>
        </meal>
      </category>
      <category name='Essen 6'>
        <meal>
          <name>Truthahncevapcici</name>
          <note>mit Pusztasauce (2, 9, J) und zwei Beilagen nach Wahl</note>
          <price role='student'>3.20</price>
          <price role='employee'>4.8</price>
          <price role='other'>4.8</price>
        </meal>
      </category>
    </day>
    <day date='2015-11-24'>
      <category name='Essen 1'>
        <meal>
          <name>Kohlrabicremesuppe</name>
          <price role='student'>0.90</price>
          <price role='employee'>2.5</price>
          <price role='other'>2.5</price>
        </meal>
      </category>
      <category name='Essen 2'>
        <meal>
          <name>China-Gemüseschnitte</name>
          <note>mit Curry-Fruchtsauce (F, G, J) und einer Beilage nach Wahl</note>
          <price role='student'>2.20</price>
          <price role='employee'>3.8</price>
          <price role='other'>3.8</price>
        </meal>
      </category>
      <category name='Essen 3'>
        <meal>
          <name>Feuriges Schweinegulasch</name>
          <note>mit Fusilli (A) und einer Beilage nach Wahl</note>
          <price role='student'>3.40</price>
          <price role='employee'>5</price>
          <price role='other'>5</price>
        </meal>
      </category>
      <category name='Essen 4'>
        <meal>
          <name>Hähnchenknusperfilet</name>
          <note>mit Pilzrahmsauce (G) und einer Beilage nach Wahl</note>
          <price role='student'>2.90</price>
          <price role='employee'>4.5</price>
          <price role='other'>4.5</price>
        </meal>
      </category>
      <category name='Essen 5'>
        <meal>
          <name>Geflügelfrikadelle</name>
          <note>mit Pilzrahmsauce (G) und einer Beilage nach Wahl</note>
          <price role='student'>2.00</price>
          <price role='employee'>3.6</price>
          <price role='other'>3.6</price>
        </meal>
      </category>
      <category name='Essen 6'>
        <meal>
          <name>Pizza Champignon</name>
          <price role='student'>3.70</price>
          <price role='employee'>5.3</price>
          <price role='other'>5.3</price>
        </meal>
      </category>
      <category name='Essen 7'>
        <meal>
          <name>Pizza Hawaii</name>
          <price role='student'>3.70</price>
          <price role='employee'>5.3</price>
          <price role='other'>5.3</price>
        </meal>
      </category>
    </day>
    <day date='2015-11-25'>
      <category name='Essen 1'>
        <meal>
          <name>Tschechische Knoblauch-Kartoffelsuppe</name>
          <price role='student'>0.90</price>
          <price role='employee'>2.5</price>
          <price role='other'>2.5</price>
        </meal>
      </category>
      <category name='Essen 2'>
        <meal>
          <name>Champignon-Gemüsepfanne</name>
          <note>mit Vollkornreis (F) und einer Beilage nach Wahl</note>
          <price role='student'>2.10</price>
          <price role='employee'>3.7</price>
          <price role='other'>3.7</price>
        </meal>
      </category>
      <category name='Essen 3'>
        <meal>
          <name>Seelachsfilet mit Gemüsestreifen</name>
          <note>und einer Beilage nach Wahl</note>
          <price role='student'>3.90</price>
          <price role='employee'>5.5</price>
          <price role='other'>5.5</price>
        </meal>
      </category>
      <category name='Essen 4'>
        <meal>
          <name>Paniertes Schweineschnitzel</name>
          <note>mit Zwiebelsauce und zwei Beilagen nach Wahl</note>
          <price role='student'>3.00</price>
          <price role='employee'>4.6</price>
          <price role='other'>4.6</price>
        </meal>
      </category>
    </day>
    <day date='2015-11-26'>
      <category name='Essen 1'>
        <meal>
          <name>Frischkäsesuppe</name>
          <price role='student'>0.90</price>
          <price role='employee'>2.5</price>
          <price role='other'>2.5</price>
        </meal>
      </category>
      <category name='Essen 2'>
        <meal>
          <name>Mais-Lauchplätzchen</name>
          <note>mit Gorgonzolarahmsauce (G) und einer Beilage nach Wahl</note>
          <price role='student'>3.40</price>
          <price role='employee'>5</price>
          <price role='other'>5</price>
        </meal>
      </category>
      <category name='Essen 3'>
        <meal>
          <name>Gefüllte Paprikaschote</name>
          <note>mit Tomatensauce und einer Beilage nach Wahl</note>
          <price role='student'>2.30</price>
          <price role='employee'>3.9</price>
          <price role='other'>3.9</price>
        </meal>
      </category>
      <category name='Essen 4'>
        <meal>
          <name>Schweineschulterbraten</name>
          <note>mit Zwiebelsauce und einer Beilage nach Wahl</note>
          <price role='student'>2.80</price>
          <price role='employee'>4.4</price>
          <price role='other'>4.4</price>
        </meal>
      </category>
      <category name='Essen 5'>
        <meal>
          <name>Gebratenes Hähnchenfleisch mit Gemüse</name>
          <note>und Basmatireis</note>
          <price role='student'>4.00</price>
          <price role='employee'>5.6</price>
          <price role='other'>5.6</price>
        </meal>
      </category>
    </day>
    <day date='2015-11-27'>
      <category name='Essen 1'>
        <meal>
          <name>Karotten-Ingwercremesuppe</name>
          <price role='student'>0.90</price>
          <price role='employee'>2.5</price>
          <price role='other'>2.5</price>
        </meal>
      </category>
      <category name='Essen 2'>
        <meal>
          <name>Sojaragout</name>
          <note>mit Glasnudeln</note>
          <price role='student'>1.90</price>
          <price role='employee'>3.5</price>
          <price role='other'>3.5</price>
        </meal>
      </category>
      <category name='Essen 3'>
        <meal>
          <name>Seelachsfilet in Sesampanade</name>
          <note>mit Remouladensauce (2, 9, A, C, G, J) und einer Beilage nach Wahl</note>
          <price role='student'>3.40</price>
          <price role='employee'>5</price>
          <price role='other'>5</price>
        </meal>
      </category>
      <category name='Essen 4'>
        <meal>
          <name>Schweinerippchen</name>
          <note>mit Sauerkraut (F) und einer Beilage nach Wahl</note>
          <price role='student'>3.60</price>
          <price role='employee'>5.2</price>
          <price role='other'>5.2</price>
        </meal>
      </category>
    </day>
    <day date='2015-11-28'>
      <category name='Essen 1'>
        <meal>
          <name>Karotten-Ingwercremesuppe</name>
          <price role='student'>0.90</price>
          <price role='employee'>2.5</price>
          <price role='other'>2.5</price>
        </meal>
      </category>
      <category name='Essen 2'>
        <meal>
          <name>Gemüseschnitzel</name>
          <note>mit Tomatensauce und einer Beilage nach Wahl</note>
          <price role='student'>1.60</price>
          <price role='employee'>3.2</price>
          <price role='other'>3.2</price>
        </meal>
      </category>
      <category name='Essen 3'>
        <meal>
          <name>Hähnchen Cordon bleu</name>
          <note>mit Geflügelsauce und einer Beilage nach Wahl</note>
          <price role='student'>2.50</price>
          <price role='employee'>4.1</price>
          <price role='other'>4.1</price>
        </meal>
      </category>
    </day>

  </canteen>
</openmensa>
